{
  "page": 1,
  "results": [
    {
      "backdrop_path": "/mAJ84W6I8I272Da87qplS2Dp9ST.jpg",
      "first_air_date": "2023-01-23",
      "genre_ids": [
        9648
      ],
      "id": 202250,
      "name": "Dirty Linen",
      "origin_country": [
        "PH"
      ],
      "original_language": "tl",
      "original_name": "Dirty Linen",
      "overview": "To exact vengeance, a young woman infiltrates the household of an influential family as a housemaid to expose their dirty secrets. However, love will get in the way of her revenge plot.",
      "popularity": 2684.061,
      "poster_path": "/ujlkQtHAVShWyWTloGU2Vh5Jbo9.jpg",
      "vote_average": 5,
      "vote_count": 13
    }
  ],
  "total_pages": 7414,
  "total_results": 148265
}