{
  "page": 1,
  "results": [
    {
      "adult": false,
      "backdrop_path": "/2yZXtM2Kky1Sy0kachbDlwybl3y.jpg",
      "genre_ids": [
        10765
      ],
      "id": 1705,
      "origin_country": [
        "US"
      ],
      "original_language": "en",
      "original_name": "Fringe",
      "overview": "FBI Special Agent Olivia Dunham, brilliant but formerly institutionalized scientist Walter Bishop and his scheming, reluctant son Peter uncover a deadly mystery involving a series of unbelievable events and realize they may be a part of a larger, more disturbing pattern that blurs the line between science fiction and technology.",
      "popularity": 151.906,
      "poster_path": "/sY9hg5dLJ93RJOyKEiu1nAtBRND.jpg",
      "first_air_date": "2008-09-09",
      "name": "Fringe",
      "vote_average": 8.109,
      "vote_count": 2050,
      "rating": 9
    }
  ],
  "total_pages": 15,
  "total_results": 290
}