{
  "page": 1,
  "results": [
    {
      "adult": false,
      "gender": 1,
      "id": 224513,
      "known_for": [
        {
          "adult": {},
          "backdrop_path": {},
          "genre_ids": {},
          "id": {},
          "media_type": {},
          "original_language": {},
          "original_title": {},
          "overview": {},
          "poster_path": {},
          "release_date": {},
          "title": {},
          "video": {},
          "vote_average": {},
          "vote_count": {}
        }
      ],
      "known_for_department": "Acting",
      "name": "Ana de Armas",
      "popularity": 343.33,
      "profile_path": "/3vxvsmYLTf4jnr163SUlBIw51ee.jpg"
    }
  ],
  "total_pages": 500,
  "total_results": 10000
}