{
  "page": 1,
  "results": [
    {
      "adult": false,
      "backdrop_path": "/bsNm9z2TJfe0WO3RedPGWQ8mG1X.jpg",
      "id": 1396,
      "name": "Breaking Bad",
      "original_language": "en",
      "original_name": "Breaking Bad",
      "overview": "When Walter White, a New Mexico chemistry teacher, is diagnosed with Stage III cancer and given a prognosis of only two years left to live. He becomes filled with a sense of fearlessness and an unrelenting desire to secure his family's financial future at any cost as he enters the dangerous world of drugs and crime.",
      "poster_path": "/ggFHVNu6YYI5L9pCfOacjizRGt.jpg",
      "media_type": "tv",
      "genre_ids": [
        18
      ],
      "popularity": 292.904,
      "first_air_date": "2008-01-20",
      "vote_average": 8.878,
      "vote_count": 11544,
      "origin_country": [
        "US"
      ]
    }
  ],
  "total_pages": 2,
  "total_results": 40
}