{
  "page": 1,
  "results": [
    {
      "adult": false,
      "backdrop_path": "/44immBwzhDVyjn87b3x3l9mlhAD.jpg",
      "id": 934433,
      "title": "Scream VI",
      "original_language": "en",
      "original_title": "Scream VI",
      "overview": "Following the latest Ghostface killings, the four survivors leave Woodsboro behind and start a fresh chapter.",
      "poster_path": "/wDWwtvkRRlgTiUr6TyLSMX8FCuZ.jpg",
      "media_type": "movie",
      "genre_ids": [
        27
      ],
      "popularity": 609.941,
      "release_date": "2023-03-08",
      "video": false,
      "vote_average": 7.374,
      "vote_count": 684
    }
  ],
  "total_pages": 1000,
  "total_results": 20000
}